{
  "schema_version": 1,
  "id": "ch2_01",
  "difficulty_id": "ch2_01",
  "status": "stub",
  "chapter_id": "ch2",
  "index_in_chapter": 1,
  "display_name": "红魔馆正门",
  "display_name_key": "level.ch2_01.name",
  "kind": "normal",
  "route_type": "double_entrance",
  "guard_point": {
    "id": "guard.scarlet_clock",
    "display_name": "钟楼大钟"
  },
  "summary": "美铃加入。正门和侧门都有路，侧门只漏几只，先学会把她放在门口挡旧电器。",
  "player_feeling": "比琪露诺那关松。新东西是「挡得住」，不是更凶的一波。",
  "teaches": [
    "美铃能挡住路上的残影",
    "旧电器又慢又硬，先挡再打",
    "第二个入口这关几乎不施压"
  ],
  "new_character_ids": [
    "chr_meiling"
  ],
  "new_enemy_ids": [
    "enm_shade_armored"
  ],
  "params": {
    "starting_spirit_power": 150,
    "lives": 20,
    "available_character_ids": [
      "chr_reimu",
      "chr_marisa",
      "chr_cirno",
      "chr_meiling"
    ]
  },
  "bosses": [],
  "wave_count": 8,
  "design_notes": "双入口从这里开始，但侧门波次要很少，避免和挡门课抢注意力。美铃的符卡决斗不做成完整首领关：她在本关后段加入，下一关起可以放置。若制作人希望美铃也有首领阶段，用图鉴里的 boss_meiling，不要新造 id。 数值上的带甲敌人已经确认，id 是 enm_shade_armored。主题上属于这一章。第一章第 3 关只预告了 3 只。这里画图时用 enm_shade_armored，不要再给旧电器另写一套生命。",
  "placeholders": {
    "_placeholder": true,
    "align_with": [
      "数值策划",
      "战斗策划"
    ],
    "note": "开局灵力 150、每活过一波加 20、生命 20，写在 data/balance/level_tables/level_difficulty.csv。那张表归数值策划，当前是种子，系数全部 1.0。敌人的生命和移速不写在关卡里。地图字符、地形 id 和首领格子集合跟战斗策划的读图约定对齐。"
  }
}
